source_id	source_title	source_type	source_scope	source_date	source_citation	edition	editors_or_authors	publisher	coverage_limits	extraction_method	packet_ids	extraction_status	notes
e001_local_accepted_canon_records	Accepted _canon records, Wave 005 baseline	accepted_site_record	Local accepted site records in _canon/*.md	2026-05-03	Local repository snapshot at commit 64600ddb264839d57a173438490f36eeed4c31b3; _canon/*.md	Wave 005 baseline	Codex/local accepted records	benjaminkramer50.github.io	Internal accepted records only; not an external canon source; embedded evidence remains separate source debt	Parse front matter where canon_review.status starts with accepted and match canon_id to incumbent path IDs	E001	extracted	61 accepted records matched to incumbent path
bloom_curated_seed_layer	Harold Bloom curated seed layer	legacy_canon_list	Western literature seed layer used as one evidence layer only	2026-05-02 local audit freeze	Local audit narrative reports 200/200 Bloom seed matches; machine-readable seed list not present	local audit artifact	Harold Bloom / project-curated extraction	unknown	Western-weighted; not global; not sufficient as sole support	Recover or reconstruct 200 seed rows, then match against current path	E002	not_started	Blocked pending machine-readable seed list
bloom_full_appendix_1994	The Western Canon full appendix	legacy_canon_list	Western canon appendix cleanup layer	1994	Harold Bloom, The Western Canon: The Books and School of the Ages, appendix; edition/publisher not locally captured	unknown	Harold Bloom	unknown	Western-heavy legacy canon list; not global; cannot be sole support for locked inclusion	Local raw appendix extraction plus current-path matching	E003	not_started	Raw import artifact absent from repo
bloom_full_appendix_review_batches	Local Bloom appendix review batches	packet_audit_output	Local reviewed/staged Bloom decisions	2026-05-02	_planning/canon_literature_audit_2026_05_02.md	local audit output	local canon audit	local	Derived review layer, not an external source	Decision reconciliation after raw/reviewed Bloom tables are recovered	E003	not_started	Underlying reviewed table absent; only summary counts available
norton_world_lit_5e_full_pre1650	The Norton Anthology of World Literature, 5th ed., Full Edition, Beginnings to 1650	world_literature_anthology	Ancient to 1650; volumes A-C	2024	Norton official anthology pages; package/TOC pages confirm edition and volume structure	5th ed., Vols. A-C	Martin Puchner and coeditors	W. W. Norton	Public Norton pages confirm package but not complete line-item TOC	Extract verified public catalog/ebook/physical-copy TOC line items; match by title, creator, alias, and contained work	E004	in_progress	Requires complete TOC access before exhaustive source_items can be claimed
norton_world_lit_5e_full_post1650	The Norton Anthology of World Literature, 5th ed., Full Edition, 1650 to Present	world_literature_anthology	1650 to present; volumes D-F	2024	Norton official anthology pages; pricing/package pages confirm post-1650 volumes	5th ed., Vols. D-F	Martin Puchner and coeditors	W. W. Norton	Public line-item TOC not fully exposed	Extract verified public catalog/ebook/physical-copy TOC line items; match by title, creator, alias, and contained work	E004	in_progress	Use shorter edition only as derivative after full edition is registered
longman_world_lit_2e_2009	The Longman Anthology of World Literature	world_literature_anthology	Six-volume world literature anthology, ancient world through twentieth century	2009	Pearson/Longman second edition; WorldCat OCLC 224444059	2nd ed.	David Damrosch; David L. Pike; April Alliston; Marshall Brown; Sabry Hafez; Djelal Kadir; Sheldon Pollock; Bruce Robbins; Haruo Shirane; Jane Tylus; Pauline Yu	Pearson/Longman	Public TOCs are uneven and sometimes retailer-derived; many items are excerpts or selections	Extract public TOC metadata only; encode complete/excerpt/selection/context status; match against current path	E005	in_progress	Strong anthology source layer, not decisive alone
bedford_world_lit_compact_v1_2009	The Bedford Anthology of World Literature, Compact Edition, Volume 1: The Ancient, Medieval, and Early Modern World	world_literature_anthology	Beginnings to 1650	2009	Davis, Paul; Gary Harrison; David M. Johnson; John F. Crawford. Bedford/St. Martin's, 2009. ISBN 9780312441531	Compact ed., Vol. 1	Paul Davis; Gary Harrison; David M. Johnson; John F. Crawford	Bedford/St. Martin's	Public TOC fragment only; not complete enough for full extraction from web alone	Extract public TOC anchors; match against current path; mark inaccessible remainder unresolved	E006	in_progress	Primary Bedford layer, partial public TOC
bedford_world_lit_compact_v2_2008	The Bedford Anthology of World Literature, Compact Edition, Volume 2: The Modern World	world_literature_anthology	1650 to present	2008	Davis, Paul; Gary Harrison; David M. Johnson; John F. Crawford. Bedford/St. Martin's, 2008. ISBN 9780312441548	Compact ed., Vol. 2	Paul Davis; Gary Harrison; David M. Johnson; John F. Crawford	Bedford/St. Martin's	Public TOC fragment only; not complete enough for full extraction from web alone	Extract public TOC anchors; match against current path; mark inaccessible remainder unresolved	E006	in_progress	Primary Bedford modern layer, partial public TOC
