source_id	source_title	source_type	source_scope	source_date	source_citation	edition	editors_or_authors	publisher	coverage_limits	extraction_method	packet_ids	extraction_status	notes
x064_encyclopedia_com_lyrics_lowly_life_reference	Encyclopedia.com: Lyrics of Lowly Life	reference_encyclopedia	Work-specific public reference entry for Paul Laurence Dunbar's Lyrics of Lowly Life	accessed 2026-05-04	Encyclopedia.com, Lyrics of Lowly Life, https://www.encyclopedia.com/history/culture-magazines/lyrics-lowly-life	online reference entry	John Bird; American History Through Literature 1870-1920 / Gale	Encyclopedia.com / Gale	Work-specific reference support, not anthology selection evidence	Targeted X064 public reference review	X064	extracted	Used as complete-work support for Lyrics of Lowly Life; source explicitly identifies the 1896 book and its literary-historical importance.
x064_poetry_foundation_dunbar_reference	Poetry Foundation: Paul Laurence Dunbar	reference_encyclopedia	Poetry Foundation public biography with work-specific Lyrics of Lowly Life discussion	accessed 2026-05-04	Poetry Foundation, Paul Laurence Dunbar, https://www.poetryfoundation.org/poets/paul-laurence-dunbar	online poet biography	Poetry Foundation	Poetry Foundation	Author biography; supports work-specific collection identity and reception, not anthology selection	Targeted X064 public reference review	X064	extracted	Used as independent public reference support for Lyrics of Lowly Life.
x070_balcells_all_fires_fire_reference	Agencia Literaria Carmen Balcells: Todos los fuegos el fuego	publisher_reference_series	Author-agency work page for Todos los fuegos el fuego / All Fires the Fire	accessed 2026-05-04	Agencia Literaria Carmen Balcells, Todos los fuegos el fuego / All Fires the Fire, https://www.agenciabalcells.com/en/authors/works/julio-cortazar/todos-los-fuegos-el-fuego/	online rights/work page	Agencia Literaria Carmen Balcells	Agencia Literaria Carmen Balcells	Rights/agency work page; supports title, creator, form, year, and contents	Targeted X070 public publisher/rights review	X070	extracted	Identifies Todos los fuegos el fuego / All Fires the Fire as a 1966 Cortazar short-story collection.
x070_britannica_all_fires_fire_reference	Britannica: All Fires the Fire, and Other Stories	reference_encyclopedia	Work-specific Britannica reference entry for Cortazar's All Fires the Fire	accessed 2026-05-04	Encyclopaedia Britannica, All Fires the Fire, and Other Stories, https://www.britannica.com/topic/All-Fires-the-Fire-and-Other-Stories	online reference entry	Encyclopaedia Britannica	Encyclopaedia Britannica	Work-specific reference support only	Targeted X070 public reference review	X070	extracted	Confirms All Fires the Fire, and Other Stories / Todos los fuegos el fuego as short stories by Cortazar.
x070_britannica_bradstreet_tenth_muse_reference	Britannica: The Tenth Muse Lately Sprung Up in America	reference_encyclopedia	Work-specific Britannica reference entry for Anne Bradstreet's The Tenth Muse	accessed 2026-05-04	Encyclopaedia Britannica, The Tenth Muse Lately Sprung Up in America, https://www.britannica.com/topic/The-Tenth-Muse-Lately-Sprung-Up-in-America	online reference entry	Encyclopaedia Britannica	Encyclopaedia Britannica	Work-specific reference support only	Targeted X070 public reference review	X070	extracted	Confirms title, creator, and 1650 work identity for the Bradstreet collection.
x070_encyclopedia_com_blow_up_reference	Encyclopedia.com: Blow-Up and Other Stories	reference_encyclopedia	World Literature and Its Times entry for Blow-Up and Other Stories	accessed 2026-05-04	Encyclopedia.com, Blow-Up and Other Stories, https://www.encyclopedia.com/arts/culture-magazines/blow-and-other-stories	online reference entry	Gale / World Literature and Its Times	Encyclopedia.com / Gale	Work-specific reference entry; supports collection identity and reception	Targeted X070 public reference review	X070	extracted	Identifies Blow-Up and Other Stories as a Cortazar short-story collection.
x070_encyclopedia_com_taner_baybars_hikmet_reference	Encyclopedia.com: Baybars, Taner	reference_encyclopedia	Reference entry for Taner Baybars listing his translation of Selected Poems of Nazim Hikmet	accessed 2026-05-04	Encyclopedia.com, Baybars, Taner, https://www.encyclopedia.com/arts/culture-magazines/baybars-taner	online reference entry	Encyclopedia.com	Encyclopedia.com / Gale	Translator bibliography; exact title support but indirect for Hikmet's current selected-poems row	Targeted X070 public reference review	X070	extracted	Lists Baybars as translator of Selected Poems of Nazim Hikmet, London: Cape, 1967.
x070_los_angeles_times_primo_levi_collected_poems_review	Los Angeles Times: The Blackness and Radiance of Primo Levi	prize_or_reception_layer	Los Angeles Times review/reference to Primo Levi's Collected Poems	accessed 2026-05-04	Richard Eder, The Blackness and Radiance of Primo Levi, Los Angeles Times, 1988-12-18, https://www.latimes.com/archives/la-xpm-1988-12-18-bk-981-story.html	newspaper review	Richard Eder	Los Angeles Times	Reception/review evidence; supports edition identity, not broad canon rank by itself	Targeted X070 public review/reception review	X070	extracted	References Collected Poems translated by Ruth Feldman and Brian Swann and published by Faber and Faber.
x070_macmillan_walcott_collected_poems_reference	Macmillan: Collected Poems, 1948-1984	publisher_reference_series	Official Macmillan/FSG page for Derek Walcott's Collected Poems, 1948-1984	accessed 2026-05-04	Macmillan, Collected Poems, 1948-1984, https://us.macmillan.com/books/9780374520250/collectedpoems19481984/	Farrar, Straus and Giroux paperback listing	Derek Walcott	Macmillan / Farrar, Straus and Giroux	Publisher page; supports collection identity and publication record	Targeted X070 public publisher review	X070	extracted	Official publisher page identifies the collection and describes its scope.
x070_nobel_milosz_bibliography_reference	Nobel Prize: Czeslaw Milosz Bibliography	prize_or_reception_layer	Nobel Prize bibliography listing multiple Milosz Selected Poems editions	accessed 2026-05-04	NobelPrize.org, Czeslaw Milosz Bibliography, https://www.nobelprize.org/prizes/literature/1980/milosz/bibliography/	online laureate bibliography	Nobel Prize Outreach	Nobel Prize Outreach	Reception/bibliographic layer; exact selected-poems support	Targeted X070 public Nobel bibliography review	X070	extracted	Lists Selected Poems editions including 1968, 1973, and Selected Poems 1931-2004.
x070_nobel_walcott_bibliography_reference	Nobel Prize: Derek Walcott Bibliography	prize_or_reception_layer	Nobel Prize bibliography listing Walcott's Collected Poems 1948-1984	accessed 2026-05-04	NobelPrize.org, Derek Walcott Bibliography, https://www.nobelprize.org/prizes/literature/1992/walcott/bibliography/	online laureate bibliography	Nobel Prize Outreach	Nobel Prize Outreach	Reception/bibliographic layer; not a teaching anthology	Targeted X070 public Nobel bibliography review	X070	extracted	Lists Collected Poems 1948-1984 in Walcott's Nobel bibliography.
x070_penguin_random_house_blow_up_reference	Penguin Random House: Blow-Up	publisher_reference_series	Official Penguin Random House page for Blow-Up: And Other Stories	accessed 2026-05-04	Penguin Random House, Blow-Up by Julio Cortazar, https://www.penguinrandomhouse.com/books/32198/blow-up-by-julio-cortazar/	Pantheon paperback listing	Julio Cortazar	Penguin Random House / Pantheon	Publisher page; supports current English collection title and contents	Targeted X070 public publisher review	X070	extracted	Official publisher page identifies Blow-Up: And Other Stories and lists the collection details.
x070_poetry_foundation_bradstreet_tenth_muse_reference	Poetry Foundation: Anne Bradstreet	reference_encyclopedia	Poetry Foundation poet biography with work-specific The Tenth Muse discussion	accessed 2026-05-04	Poetry Foundation, Anne Bradstreet, https://www.poetryfoundation.org/poets/anne-bradstreet	online poet biography	Poetry Foundation	Poetry Foundation	Author biography; supports work-specific collection identity and reception	Targeted X070 public reference review	X070	extracted	Confirms The Tenth Muse as Bradstreet's poetry volume first published in London in 1650.
x070_poetry_foundation_hikmet_selected_poems_reference	Poetry Foundation: Nazim Hikmet	reference_encyclopedia	Poetry Foundation biography listing Hikmet's Selected Poems	accessed 2026-05-04	Poetry Foundation, Nazim Hikmet, https://www.poetryfoundation.org/poets/nazim-hikmet	online poet biography	Poetry Foundation	Poetry Foundation	Author biography; supports selected-poems translation identity	Targeted X070 public reference review	X070	extracted	Lists Selected Poems (1967; translated by Taner Baybars) among Hikmet's English translations.
x070_poetry_foundation_primo_levi_reference	Poetry Foundation: Primo Levi	reference_encyclopedia	Poetry Foundation biography with work-specific Collected Poems: Primo Levi discussion	accessed 2026-05-04	Poetry Foundation, Primo Levi, https://www.poetryfoundation.org/poets/primo-levi	online poet biography	Poetry Foundation	Poetry Foundation	Author biography; supports work-specific poetry collection identity	Targeted X070 public reference review	X070	extracted	Identifies Collected Poems: Primo Levi and its translated collection scope.
x070_washington_post_milosz_selected_poems_review	Washington Post: Czeslaw Milosz and the Laurels of Literature	prize_or_reception_layer	Washington Post review discussion of Milosz's Selected Poems	accessed 2026-05-04	Czeslaw Milosz And the Laurels Of Literature, Washington Post, 1981-06-14, https://www.washingtonpost.com/archive/entertainment/books/1981/06/14/czeslaw-milosz-and-the-laurels-of-literature/652bcf28-046e-44e3-9c16-1b63f5fe230f/	newspaper review	Washington Post	Washington Post	Reception/review evidence; supports selected-poems identity and English reception	Targeted X070 public review/reception review	X070	extracted	Discusses Selected Poems as the representative English collection available after the Nobel award.
