source_id	source_title	source_type	source_scope	source_date	source_citation	edition	editors_or_authors	publisher	coverage_limits	extraction_method	packet_ids	extraction_status	notes
x077_google_books_gogols_wife	Google Books: Gogol's Wife and Other Stories	publisher_reference_series	External exact-title support for Gogol's Wife and Other Stories by Tommaso Landolfi	accessed 2026-05-04	Google Books, Gogol's Wife and Other Stories by Tommaso Landolfi, https://books.google.com/books/about/Gogol_s_Wife_Other_Stories.html?id=Bjyd5WfLlf0C	online reference, review, prize, or edition page	Tommaso Landolfi	Google Books	Build-layer source-debt support only; no cut or replacement approval.	Targeted X077 exact-title public source review	X077	extracted	Supports Italian short story collection in translation identity and external source debt closure.
x077_google_books_road_allowance	Google Books: Stories of the Road Allowance People	publisher_reference_series	External exact-title support for Stories of the Road Allowance People by Maria Campbell	accessed 2026-05-04	Google Books, Stories of the Road Allowance People, https://books.google.com/books/about/Stories_of_the_Road_Allowance_People.html?id=_orYAAAAMAAJ	online reference, review, prize, or edition page	Maria Campbell	Google Books	Build-layer source-debt support only; no cut or replacement approval.	Targeted X077 exact-title public source review	X077	extracted	Supports Metis oral story collection identity and external source debt closure.
x077_google_books_summer_lightning	Google Books: Summer Lightning and Other Stories	publisher_reference_series	External exact-title support for Summer Lightning by Olive Senior	accessed 2026-05-04	Google Books, Summer Lightning: And Other Stories by Olive Senior, https://books.google.com/books/about/Summer_Lightning.html?id=4cdyAAAAMAAJ	online reference, review, prize, or edition page	Olive Senior	Google Books	Build-layer source-debt support only; no cut or replacement approval.	Targeted X077 exact-title public source review	X077	extracted	Supports Jamaican short story collection identity and external source debt closure.
x077_google_books_tales_tikongs	Google Books: Tales of the Tikongs	publisher_reference_series	External exact-title support for Tales of the Tikongs by Epeli Hau'ofa	accessed 2026-05-04	Google Books, Tales of the Tikongs by Epeli Hau'ofa, https://books.google.com/books/about/Tales_of_the_Tikongs.html?id=sUkWYJ6JplwC	online reference, review, prize, or edition page	Epeli Hau'ofa	Google Books	Build-layer source-debt support only; no cut or replacement approval.	Targeted X077 exact-title public source review	X077	extracted	Supports Pacific Islander satirical short story collection identity and external source debt closure.
x077_lat_tales_tikongs_review	Los Angeles Times: Tales of the Tikongs	prize_or_reception_layer	External exact-title support for Tales of the Tikongs by Epeli Hau'ofa	accessed 2026-05-04	Los Angeles Times, Tales of the Tikongs by Epeli Hau'ofa, https://www.latimes.com/archives/la-xpm-1994-09-18-bk-39847-story.html	online reference, review, prize, or edition page	Epeli Hau'ofa	Los Angeles Times	Build-layer source-debt support only; no cut or replacement approval.	Targeted X077 exact-title public source review	X077	extracted	Supports Pacific Islander satirical short story collection identity and external source debt closure.
x077_prh_horror_classics_bloody_chamber	Penguin Random House: Horror Classics You Need To Read	prize_or_reception_layer	External exact-title support for The Bloody Chamber by Angela Carter	accessed 2026-05-04	Penguin Random House, Horror Classics You Need To Read, https://www.penguinrandomhouse.com/the-read-down/horror-classics-you-need-to-read/	online reference, review, prize, or edition page	Angela Carter	Penguin Random House	Build-layer source-debt support only; no cut or replacement approval.	Targeted X077 exact-title public source review	X077	extracted	Supports British feminist Gothic short story collection identity and external source debt closure.
x077_random_house_bloody_chamber	Random House: The Bloody Chamber	publisher_reference_series	External exact-title support for The Bloody Chamber by Angela Carter	accessed 2026-05-04	Random House Publishing Group, The Bloody Chamber by Angela Carter, https://www.randomhousebooks.com/books/308852	online reference, review, prize, or edition page	Angela Carter	Random House	Build-layer source-debt support only; no cut or replacement approval.	Targeted X077 exact-title public source review	X077	extracted	Supports British feminist Gothic short story collection identity and external source debt closure.
x077_time_gogols_wife_review	Time: Of Beasts & Men	prize_or_reception_layer	External exact-title support for Gogol's Wife and Other Stories by Tommaso Landolfi	accessed 2026-05-04	Time, Books: Of Beasts & Men, https://content.time.com/time/subscriber/article/0,33009,898142,00.html	online reference, review, prize, or edition page	Tommaso Landolfi	Time	Build-layer source-debt support only; no cut or replacement approval.	Targeted X077 exact-title public source review	X077	extracted	Supports Italian short story collection in translation identity and external source debt closure.
x077_uhpress_tales_tikongs	University of Hawaii Press: Tales of the Tikongs	publisher_reference_series	External exact-title support for Tales of the Tikongs by Epeli Hau'ofa	accessed 2026-05-04	University of Hawaii Press, Tales of the Tikongs, https://uhpress.hawaii.edu/title/tales-of-the-tikongs/?attribute_pa_format=paperback	online reference, review, prize, or edition page	Epeli Hau'ofa	University of Hawaii Press	Build-layer source-debt support only; no cut or replacement approval.	Targeted X077 exact-title public source review	X077	extracted	Supports Pacific Islander satirical short story collection identity and external source debt closure.
x077_uw_press_stories_old_and_new	University of Washington Press: Stories Old and New	publisher_reference_series	External exact-title support for Stories Old and New by Feng Menglong	accessed 2026-05-04	University of Washington Press, Stories Old and New, https://uwapress.uw.edu/book/9780295995823/stories-old-and-new/	online reference, review, prize, or edition page	Feng Menglong	University of Washington Press	Build-layer source-debt support only; no cut or replacement approval.	Targeted X077 exact-title public source review	X077	extracted	Supports Ming vernacular story collection identity and external source debt closure.
x077_writers_trust_olive_senior_summer_lightning	Writers' Trust of Canada: Olive Senior	prize_or_reception_layer	External exact-title support for Summer Lightning by Olive Senior	accessed 2026-05-04	Writers' Trust of Canada, Olive Senior, https://www.writerstrust.com/authors/olive-senior	online reference, review, prize, or edition page	Olive Senior	Writers' Trust of Canada	Build-layer source-debt support only; no cut or replacement approval.	Targeted X077 exact-title public source review	X077	extracted	Supports Jamaican short story collection identity and external source debt closure.
x078_britannica_book_of_sand	Britannica: The Book of Sand	reference_encyclopedia	External exact-title support for The Book of Sand by Jorge Luis Borges	accessed 2026-05-04	Encyclopaedia Britannica, The Book of Sand, https://www.britannica.com/topic/The-Book-of-Sand	online reference, review, prize, or edition page	Jorge Luis Borges	Britannica	Build-layer source-debt support only; no cut or replacement approval.	Targeted X078 exact-title public source review	X078	extracted	Supports Argentine short story collection identity and external source debt closure.
x078_britannica_burning_plain	Britannica: The Burning Plain	reference_encyclopedia	External exact-title support for The Burning Plain by Juan Rulfo	accessed 2026-05-04	Encyclopaedia Britannica, The Burning Plain, https://www.britannica.com/topic/The-Burning-Plain	online reference, review, prize, or edition page	Juan Rulfo	Britannica	Build-layer source-debt support only; no cut or replacement approval.	Targeted X078 exact-title public source review	X078	extracted	Supports Mexican short story collection identity and external source debt closure.
x078_britannica_new_net	Britannica: The New Net Goes Fishing	reference_encyclopedia	External exact-title support for The New Net Goes Fishing by Witi Ihimaera	accessed 2026-05-04	Encyclopaedia Britannica, The New Net Goes Fishing, https://www.britannica.com/topic/New-Net-Goes-Fishing-The	online reference, review, prize, or edition page	Witi Ihimaera	Britannica	Build-layer source-debt support only; no cut or replacement approval.	Targeted X078 exact-title public source review	X078	extracted	Supports Maori short story collection identity and external source debt closure.
x078_comma_madman_freedom_square	Comma Press: The Madman of Freedom Square	publisher_reference_series	External exact-title support for The Madman of Freedom Square by Hassan Blasim	accessed 2026-05-04	Comma Press, The Madman of Freedom Square, https://commapress.co.uk/books/the-madman-of-freedom-square	online reference, review, prize, or edition page	Hassan Blasim	Comma Press	Build-layer source-debt support only; no cut or replacement approval.	Targeted X078 exact-title public source review	X078	extracted	Supports Iraqi short story collection in English translation identity and external source debt closure.
x078_encyclopedia_new_net	Encyclopedia.com: Witi Ihimaera	language_literary_history	External exact-title support for The New Net Goes Fishing by Witi Ihimaera	accessed 2026-05-04	Encyclopedia.com, Witi Ihimaera, https://www.encyclopedia.com/people/social-sciences-and-law/political-science-biographies/witi-ihimaera	online reference, review, prize, or edition page	Witi Ihimaera	Encyclopedia.com	Build-layer source-debt support only; no cut or replacement approval.	Targeted X078 exact-title public source review	X078	extracted	Supports Maori short story collection identity and external source debt closure.
x078_english_pen_madman_freedom_square	English PEN: The Madman of Freedom Square	prize_or_reception_layer	External exact-title support for The Madman of Freedom Square by Hassan Blasim	accessed 2026-05-04	English PEN, The Madman of Freedom Square, https://www.englishpen.org/posts/news/the-madman-of-freedom-square/	online reference, review, prize, or edition page	Hassan Blasim	English PEN	Build-layer source-debt support only; no cut or replacement approval.	Targeted X078 exact-title public source review	X078	extracted	Supports Iraqi short story collection in English translation identity and external source debt closure.
x078_google_books_collected_colette	Google Books: Collected Stories of Colette	publisher_reference_series	External exact-title support for The Collected Stories of Colette by Colette	accessed 2026-05-04	Google Books, Collected Stories of Colette, https://books.google.com/books/about/Collected_Stories_of_Colette.html?id=TVvoRX9IblIC	online reference, review, prize, or edition page	Colette	Google Books	Build-layer source-debt support only; no cut or replacement approval.	Targeted X078 exact-title public source review	X078	extracted	Supports French short story collection in English translation identity and external source debt closure.
x078_google_books_encyclopedia_dead	Google Books: The Encyclopedia of the Dead	publisher_reference_series	External exact-title support for The Encyclopedia of the Dead by Danilo Kis	accessed 2026-05-04	Google Books, The Encyclopedia of the Dead by Danilo Kis, https://books.google.com/books/about/The_Encyclopedia_of_the_Dead.html?id=6eqzrQEACAAJ	online reference, review, prize, or edition page	Danilo Kis	Google Books	Build-layer source-debt support only; no cut or replacement approval.	Targeted X078 exact-title public source review	X078	extracted	Supports Yugoslav short story collection identity and external source debt closure.
x078_google_books_lottery_stories	Google Books: The Lottery and Other Stories	publisher_reference_series	External exact-title support for The Lottery and Other Stories by Shirley Jackson	accessed 2026-05-04	Google Books, The Lottery and Other Stories by Shirley Jackson, https://books.google.com/books/about/The_Lottery_and_Other_Stories.html?id=B9hEAwAAQBAJ	online reference, review, prize, or edition page	Shirley Jackson	Google Books	Build-layer source-debt support only; no cut or replacement approval.	Targeted X078 exact-title public source review	X078	extracted	Supports American Gothic short story collection identity and external source debt closure.
x078_grove_lone_ranger_tonto	Grove Atlantic: The Lone Ranger and Tonto Fistfight in Heaven	publisher_reference_series	External exact-title support for The Lone Ranger and Tonto Fistfight in Heaven by Sherman Alexie	accessed 2026-05-04	Grove Atlantic, The Lone Ranger and Tonto Fistfight in Heaven, https://groveatlantic.com/book/the-lone-ranger-and-tonto-fistfight-in-heaven/	online reference, review, prize, or edition page	Sherman Alexie	Grove Atlantic	Build-layer source-debt support only; no cut or replacement approval.	Targeted X078 exact-title public source review	X078	extracted	Supports Native American interconnected short story collection identity and external source debt closure.
x078_macmillan_collected_colette	Macmillan: Collected Stories of Colette	publisher_reference_series	External exact-title support for The Collected Stories of Colette by Colette	accessed 2026-05-04	Macmillan Publishers, Collected Stories of Colette, https://us.macmillan.com/books/9780374518653/collectedstoriesofcolette/	online reference, review, prize, or edition page	Colette	Macmillan	Build-layer source-debt support only; no cut or replacement approval.	Targeted X078 exact-title public source review	X078	extracted	Supports French short story collection in English translation identity and external source debt closure.
x078_macmillan_lottery_stories	Macmillan: The Lottery and Other Stories	publisher_reference_series	External exact-title support for The Lottery and Other Stories by Shirley Jackson	accessed 2026-05-04	Macmillan Publishers, The Lottery and Other Stories, https://us.macmillan.com/books/9781250910158/thelotteryandotherstories/	online reference, review, prize, or edition page	Shirley Jackson	Macmillan	Build-layer source-debt support only; no cut or replacement approval.	Targeted X078 exact-title public source review	X078	extracted	Supports American Gothic short story collection identity and external source debt closure.
x078_nbf_sherman_alexie_lone_ranger_tonto	National Book Foundation: Sherman Alexie	prize_or_reception_layer	External exact-title support for The Lone Ranger and Tonto Fistfight in Heaven by Sherman Alexie	accessed 2026-05-04	National Book Foundation, Sherman Alexie, https://www.nationalbook.org/people/sherman-alexie/	online reference, review, prize, or edition page	Sherman Alexie	National Book Foundation	Build-layer source-debt support only; no cut or replacement approval.	Targeted X078 exact-title public source review	X078	extracted	Supports Native American interconnected short story collection identity and external source debt closure.
x078_nup_encyclopedia_dead	Northwestern University Press: Encyclopedia of the Dead	publisher_reference_series	External exact-title support for The Encyclopedia of the Dead by Danilo Kis	accessed 2026-05-04	Northwestern University Press, Encyclopedia of the Dead, https://nupress.northwestern.edu/9780810115149/encyclopedia-of-the-dead/	online reference, review, prize, or edition page	Danilo Kis	Northwestern University Press	Build-layer source-debt support only; no cut or replacement approval.	Targeted X078 exact-title public source review	X078	extracted	Supports Yugoslav short story collection identity and external source debt closure.
x078_prh_book_of_sand	Penguin Random House: The Book of Sand and Shakespeare's Memory	publisher_reference_series	External exact-title support for The Book of Sand by Jorge Luis Borges	accessed 2026-05-04	Penguin Random House, The Book of Sand and Shakespeare's Memory by Jorge Luis Borges, https://www.penguinrandomhouse.com/books/302517/the-book-of-sand-and-shakespeares-memory-by-jorge-luis-borges/	online reference, review, prize, or edition page	Jorge Luis Borges	Penguin Random House	Build-layer source-debt support only; no cut or replacement approval.	Targeted X078 exact-title public source review	X078	extracted	Supports Argentine short story collection identity and external source debt closure.
x078_utpress_burning_plain	University of Texas Press: The Burning Plain	publisher_reference_series	External exact-title support for The Burning Plain by Juan Rulfo	accessed 2026-05-04	University of Texas Press, The Burning Plain, https://utpress.utexas.edu/9781477329962/	online reference, review, prize, or edition page	Juan Rulfo	University of Texas Press	Build-layer source-debt support only; no cut or replacement approval.	Targeted X078 exact-title public source review	X078	extracted	Supports Mexican short story collection identity and external source debt closure.
x079_bibliovault_poems_st_john_cross	BiblioVault: The Poems of St. John of the Cross	publisher_reference_series	External exact-title support for The Poems of St. John of the Cross by San Juan de la Cruz (Saint John of the Cross)	accessed 2026-05-04	BiblioVault, The Poems of St. John of the Cross, https://www.bibliovault.org/BV.book.epl?ISBN=9780226401102	online reference, review, prize, or edition page	San Juan de la Cruz (Saint John of the Cross)	BiblioVault	Build-layer source-debt support only; no cut or replacement approval.	Targeted X079 exact-title public source review	X079	extracted	Supports Spanish mystical poetry collection in bilingual translation identity and external source debt closure.
x079_copper_aleixandre_longing_light	Copper Canyon Press: A Longing for the Light	publisher_reference_series	External exact-title support for A Longing for the Light: Selected Poems by Vicente Aleixandre	accessed 2026-05-04	Copper Canyon Press, A Longing for the Light: Selected Poems of Vicente Aleixandre, https://www.coppercanyonpress.org/books/a-longing-for-the-light-selected-poems-of-vicente-aleixandre/	online reference, review, prize, or edition page	Vicente Aleixandre	Copper Canyon Press	Build-layer source-debt support only; no cut or replacement approval.	Targeted X079 exact-title public source review	X079	extracted	Supports Spanish poetry selection in English translation identity and external source debt closure.
x079_ebsco_aleixandre_longing_light	EBSCO Research Starters: A Longing for the Light	language_literary_history	External exact-title support for A Longing for the Light: Selected Poems by Vicente Aleixandre	accessed 2026-05-04	EBSCO, A Longing for the Light by Vicente Aleixandre, https://www.ebsco.com/research-starters/literature-and-writing/longing-light-vicente-aleixandre	online reference, review, prize, or edition page	Vicente Aleixandre	EBSCO Research Starters	Build-layer source-debt support only; no cut or replacement approval.	Targeted X079 exact-title public source review	X079	extracted	Supports Spanish poetry selection in English translation identity and external source debt closure.
x079_google_books_cernuda_selected_poems	Google Books: Selected Poems of Luis Cernuda	publisher_reference_series	External exact-title support for Selected Poems of Luis Cernuda by Luis Cernuda	accessed 2026-05-04	Google Books, Selected Poems of Luis Cernuda, https://books.google.com/books/about/Selected_Poems_of_Luis_Cernuda.html?id=XagtAQAAIAAJ	online reference, review, prize, or edition page	Luis Cernuda	Google Books	Build-layer source-debt support only; no cut or replacement approval.	Targeted X079 exact-title public source review	X079	extracted	Supports Spanish poetry selection in English translation identity and external source debt closure.
x079_google_books_owl_insomnia	Google Books: The Owl's Insomnia	publisher_reference_series	External exact-title support for The Owl's Insomnia: Poems by Rafael Alberti	accessed 2026-05-04	Google Books, The Owl's Insomnia, https://books.google.com/books/about/The_Owl_s_Insomnia.html?id=V3sNAAAAIAAJ	online reference, review, prize, or edition page	Rafael Alberti	Google Books	Build-layer source-debt support only; no cut or replacement approval.	Targeted X079 exact-title public source review	X079	extracted	Supports Spanish poetry selection in bilingual translation identity and external source debt closure.
x079_google_books_she_wolf_stories	Google Books: The She-Wolf and Other Stories	publisher_reference_series	External exact-title support for The She-Wolf and Other Stories by Giovanni Verga	accessed 2026-05-04	Google Books, The She-Wolf and Other Stories, https://books.google.com/books/about/The_She_Wolf_and_Other_Stories.html?id=GmzfEAAAQBAJ	online reference, review, prize, or edition page	Giovanni Verga	Google Books	Build-layer source-debt support only; no cut or replacement approval.	Targeted X079 exact-title public source review	X079	extracted	Supports Italian short story collection in English translation identity and external source debt closure.
x079_google_books_unknown_light	Google Books: The Unknown Light	publisher_reference_series	External exact-title support for The Unknown Light: The Poems of Fray Luis de Leon by Fray Luis de Leon	accessed 2026-05-04	Google Books, The Unknown Light: The Poems of Fray Luis de Leon, https://books.google.com/books/about/The_Unknown_Light.html?id=U0NRAQAAIAAJ	online reference, review, prize, or edition page	Fray Luis de Leon	Google Books	Build-layer source-debt support only; no cut or replacement approval.	Targeted X079 exact-title public source review	X079	extracted	Supports Spanish Renaissance poetry collection in bilingual translation identity and external source debt closure.
x079_grove_refugees_nguyen	Grove Atlantic: The Refugees	publisher_reference_series	External exact-title support for The Refugees by Viet Thanh Nguyen	accessed 2026-05-04	Grove Atlantic, The Refugees, https://groveatlantic.com/book/the-refugees/	online reference, review, prize, or edition page	Viet Thanh Nguyen	Grove Atlantic	Build-layer source-debt support only; no cut or replacement approval.	Targeted X079 exact-title public source review	X079	extracted	Supports Vietnamese American short story collection identity and external source debt closure.
x079_jstor_chesnutt_short_fiction_review	JSTOR: The Short Fiction of Charles W. Chesnutt review	language_literary_history	External exact-title support for The Short Fiction by Charles W. Chesnutt	accessed 2026-05-04	JSTOR, The Short Fiction of Charles W. Chesnutt review, https://www.jstor.org/stable/44329143	online reference, review, prize, or edition page	Charles W. Chesnutt	JSTOR	Build-layer source-debt support only; no cut or replacement approval.	Targeted X079 exact-title public source review	X079	extracted	Supports African American short fiction collection identity and external source debt closure.
x079_nbf_refugees_nguyen	National Book Foundation: Viet Thanh Nguyen	prize_or_reception_layer	External exact-title support for The Refugees by Viet Thanh Nguyen	accessed 2026-05-04	National Book Foundation, Viet Thanh Nguyen, https://www.nationalbook.org/people/viet-thanh-nguyen/	online reference, review, prize, or edition page	Viet Thanh Nguyen	National Book Foundation	Build-layer source-debt support only; no cut or replacement approval.	Targeted X079 exact-title public source review	X079	extracted	Supports Vietnamese American short story collection identity and external source debt closure.
x079_openletter_taker_stories	Open Letter Books: The Taker and Other Stories	publisher_reference_series	External exact-title support for The Taker and Other Stories by Rubem Fonseca	accessed 2026-05-04	Open Letter Books, The Taker and Other Stories, https://www.openletterbooks.org/products/the-taker-and-other-stories	online reference, review, prize, or edition page	Rubem Fonseca	Open Letter Books	Build-layer source-debt support only; no cut or replacement approval.	Targeted X079 exact-title public source review	X079	extracted	Supports Brazilian short story collection in English translation identity and external source debt closure.
x079_poetry_foundation_owl_insomnia	Poetry Foundation: August 1974 Poetry issue	prize_or_reception_layer	External exact-title support for The Owl's Insomnia: Poems by Rafael Alberti	accessed 2026-05-04	Poetry Foundation, August 1974 Poetry issue, https://www.poetryfoundation.org/poetrymagazine/issue/71056/august-1974	online reference, review, prize, or edition page	Rafael Alberti	Poetry Foundation	Build-layer source-debt support only; no cut or replacement approval.	Targeted X079 exact-title public source review	X079	extracted	Supports Spanish poetry selection in bilingual translation identity and external source debt closure.
x079_poets_barnstone_unknown_light	Academy of American Poets: Willis Barnstone	language_literary_history	External exact-title support for The Unknown Light: The Poems of Fray Luis de Leon by Fray Luis de Leon	accessed 2026-05-04	Academy of American Poets, About Willis Barnstone, https://poets.org/poet/willis-barnstone	online reference, review, prize, or edition page	Fray Luis de Leon	Academy of American Poets	Build-layer source-debt support only; no cut or replacement approval.	Targeted X079 exact-title public source review	X079	extracted	Supports Spanish Renaissance poetry collection in bilingual translation identity and external source debt closure.
