source_id	source_title	source_type	source_scope	source_date	source_citation	edition	editors_or_authors	publisher	coverage_limits	extraction_method	packet_ids	extraction_status	notes
arlima_medieval_literature	ARLIMA: Archives de litterature du Moyen Age	bibliographic_database	European medieval authors, works, themes, and manuscripts	ongoing	ARLIMA: https://www.arlima.net/	online	ARLIMA editors	ARLIMA	Bibliographic support, not anthology selection evidence	Use author/work pages for aliases, manuscript witnesses, and bibliographic authority	E009	metadata_ready	High-value authority layer for Old French, Arthurian, Anglo-Norman, and Latin-adjacent records
bedford_world_lit_compact_v1_2009	The Bedford Anthology of World Literature, Compact Edition, Volume 1: The Ancient, Medieval, and Early Modern World	world_literature_anthology	Beginnings to 1650	2009	Davis, Paul; Gary Harrison; David M. Johnson; John F. Crawford. Bedford/St. Martin's, 2009. ISBN 9780312441531	Compact ed., Vol. 1	Paul Davis; Gary Harrison; David M. Johnson; John F. Crawford	Bedford/St. Martin's	Public TOC fragment only; not complete enough for full extraction from web alone	Extract public TOC anchors; match against current path; mark inaccessible remainder unresolved	E006	in_progress	Primary Bedford layer, partial public TOC
bedford_world_lit_compact_v2_2008	The Bedford Anthology of World Literature, Compact Edition, Volume 2: The Modern World	world_literature_anthology	1650 to present	2008	Davis, Paul; Gary Harrison; David M. Johnson; John F. Crawford. Bedford/St. Martin's, 2008. ISBN 9780312441548	Compact ed., Vol. 2	Paul Davis; Gary Harrison; David M. Johnson; John F. Crawford	Bedford/St. Martin's	Public TOC fragment only; not complete enough for full extraction from web alone	Extract public TOC anchors; match against current path; mark inaccessible remainder unresolved	E006	in_progress	Primary Bedford modern layer, partial public TOC
bibliotheca_augustana_germanica	Bibliotheca Augustana: Bibliotheca Germanica	digital_text_collection	German literature chronology including Old High German, Middle High German, and Early New High German	various	Chronology page: https://www.hs-augsburg.de/~harsch/germanica/Chronologie/d_chrono.html	online	Ulrich Harsch	HS Augsburg	Edition provenance uneven; not canon-selection evidence	Use as public text/access and alias layer; verify against specialist metadata	E009	metadata_ready	Middle High German anchor for Nibelungenlied, courtly romance, and Minnesang
bloom_curated_seed_layer	Harold Bloom curated seed layer	legacy_canon_list	Western literature seed layer used as one evidence layer only	2026-05-02 local audit freeze	Local audit narrative reports 200/200 Bloom seed matches; machine-readable seed list not present	local audit artifact	Harold Bloom / project-curated extraction	unknown	Western-weighted; not global; not sufficient as sole support	Recover or reconstruct 200 seed rows, then match against current path	E002	rejected	Blocked: exact seed artifact missing; do not reconstruct from current path annotations
bloom_full_appendix_1994	The Western Canon full appendix	legacy_canon_list	Western canon appendix cleanup layer	1994	Harold Bloom, The Western Canon: The Books and School of the Ages, appendix; edition/publisher not locally captured	unknown	Harold Bloom	unknown	Western-heavy legacy canon list; not global; cannot be sole support for locked inclusion	Local raw appendix extraction plus current-path matching	E003	in_progress	Recoverable from local untracked artifacts; policy-gated before commit/publication/scoring
bloom_full_appendix_review_batches	Local Bloom appendix review batches	packet_audit_output	Local reviewed/staged Bloom decisions	2026-05-02	_planning/canon_literature_audit_2026_05_02.md	local audit output	local canon audit	local	Derived review layer, not an external source	Decision reconciliation after raw/reviewed Bloom tables are recovered	E003	in_progress	Recoverable from local untracked artifacts; internal triage only, not external evidence
brians_modern_south_asian_lit_english_2003	Modern South Asian Literature in English	region_literary_history	Introductory critical guide to major modern South Asian English-language fiction from India, Pakistan, and Sri Lanka	2003	Bloomsbury: https://www.bloomsbury.com/us/modern-south-asian-literature-in-english-9780313320118/	1st ed.	Paul Brians	Greenwood / Bloomsbury	English-language modern fiction only; 15 selected chapters; weak for vernacular, poetry, Bangladesh, and Nepal coverage	Extract chapter and work rows from public TOC; treat as literary-history/context support, not anthology inclusion	E015;X023	extracted	Complete 15-row Gale public chapter TOC ingested; rows are literary-history context, not anthology selection evidence.
broadview_brit_lit_medieval_r3_2023	The Broadview Anthology of British Literature, Vol. 1: The Medieval Period	period_anthology	British medieval literature; Old English, Anglo-Norman, Middle English, religious, and context material	2023	Broadview official page: https://broadviewpress.com/product/the-broadview-anthology-of-british-literature-volume-1-the-medieval-period-revised-third-edition/	Revised 3rd ed.	Joseph Black and coeditors	Broadview Press	Public TOC available; companion-site items need boundary tags	Extract publisher TOC anchors; match whole works versus selections	E009	public_toc_ready	Best public layer for Old English elegies, Beowulf, Pearl, Gawain, Julian, Kempe, and drama
broadview_british_lit_concise_a_b_2019_2024	Broadview Anthology of British Literature, Concise Vols. A-B	english_literature_anthology	Medieval through twenty-first century	2019-2024	Broadview official product pages and contents	Concise A 4th; Concise B 3rd	Joseph Black and coeditors	Broadview Press	Includes companion-website material; some rows are contextual, not primary works	Extract official contents; mark bound-book versus website item; compare with Norton/Longman	E010	ready_public_toc	Modern diversity/context comparator
broadview_medieval_drama_2012	The Broadview Anthology of Medieval Drama	drama_anthology	Medieval drama across Latin, continental, and English traditions	2012	Broadview official page: https://broadviewpress.com/product/the-broadview-anthology-of-medieval-drama/	1st ed.	Christina M. Fitzgerald; John T. Sebastian	Broadview Press	Drama-only; includes documents and context sources	Extract play titles and context documents separately	E009	public_toc_ready	Useful for Hrotsvitha, Quem Quaeritis, York cycle, Everyman, and early drama checks
cambridge_history_chinese_lit_2010	The Cambridge History of Chinese Literature	language_literary_history	Scholarly history of Chinese literature from early periods through modernity	2010	Cambridge Core listing: https://www.cambridge.org/core/books/cambridge-history-of-chinese-literature/6FEBDC1995B8D05749A1F453D7577D21/listing	Vols. 1-2	Kang-i Sun Chang; Stephen Owen	Cambridge University Press	Chapter-level and partly gated; reference/context evidence, not a selection anthology	Extract public chapter metadata and accessible summaries; use for work, period, and boundary context and corroboration	E016;X025	context_only	Cambridge Core chapter lists parsed into 15 chapter-context rows across Vols. 1-2.
chinese_text_project_premodern	Chinese Text Project	digital_text_collection	Open digital library/index of premodern Chinese texts, including Pre-Qin/Han and Post-Han corpora	ongoing	Chinese Text Project: https://ctext.org/	online digital collection	Chinese Text Project	Chinese Text Project	Not a canon list; includes philosophical, historical, technical, and nonliterary texts; variable source provenance	Parse public tables of contents or API where available; use for title authority, aliases, text access, and corpus presence	E016;X024	metadata_ready	Chinese Text Project public Pre-Qin/Han index parsed into 108 title/access metadata rows; rows are not canon-selection evidence.
clay_sanskrit_library_56vol	The Complete Clay Sanskrit Library	translation_series	Classical Sanskrit literature in 56 bilingual volumes, including epic, drama, poetry, narrative, Buddhist, and Jain materials	2005-2009	Clay Sanskrit Library volume list: https://claysanskritlibrary.org/volumes/volumes-list/ ; NYU Press set: https://nyupress.org/9780814717431/the-complete-clay-sanskrit-library/	56-volume set	Clay Sanskrit Library editors	NYU Press / JJC Foundation	Sanskrit only; completed/discontinued; many rows are epic books, selections, or multi-volume parts rather than whole works	Parse official volume list and NYU product metadata; group multi-volume works; flag partial epic and book scope	E015	extracted	Complete 56-volume official Clay Sanskrit Library list ingested as translation-series metadata rows.
columbia_lithum_current_2026	Columbia Literature Humanities current reading list	university_core_reading_list	Current Columbia Lit Hum two-semester required readings	2026	https://www.college.columbia.edu/core-curriculum/classes/literature-humanities	current web page	Columbia College Core Curriculum	Columbia College	Western/core-curriculum weighted; includes instructor-choice slots and reader excerpts	Extract listed Fall/Spring works; classify complete work versus excerpt/reader item; match by title, author, and collection	E007	ready_for_extraction	High-value teaching-canon layer; not global by itself
columbia_lithum_historical_1937_present	Columbia Literature Humanities texts, 1937-present	university_core_historical_reading_list	Literature Humanities works and years studied since 1937	1937-present	https://www.college.columbia.edu/core-curriculum/lit-hum-texts-1937-2020	living historical list	Columbia College Core Curriculum	Columbia College	Many texts historically read in excerpts; instructor-choice list is nonrequired	Extract author/text/year ranges; mark required, historical, instructor-choice, and excerpt status	E007	ready_for_extraction	Useful for long-run Western teaching-canon persistence
columbia_modern_chinese_lit_2e_2007	The Columbia Anthology of Modern Chinese Literature	field_anthology	Modern Chinese literature in translation from China, Taiwan, Hong Kong, and early twenty-first-century extensions	2007	Columbia University Press: https://cup.columbia.edu/book/the-columbia-anthology-of-modern-chinese-literature/9780231138406/ ; Google Books: https://books.google.com/books?id=DRt84_yIsrAC	2nd ed.	Joseph S. M. Lau; Howard Goldblatt	Columbia University Press	Selection anthology; fiction, poetry, and essays dominate; complete-work support must be verified item by item	Use publisher metadata plus public TOC previews; extract author, title, genre, period section, and region where available	E016;X024	extracted	LOC public prepublication TOC parsed into 168 line-level rows; count supersedes the earlier 14-row pilot and older 166-item estimate.
columbia_traditional_chinese_lit_1996	The Columbia Anthology of Traditional Chinese Literature	field_anthology	Traditional Chinese literature across foundations, poetry, prose, fiction, drama, criticism, and popular/peripheral forms	1996	Columbia University Press: https://cup.columbia.edu/book/the-columbia-anthology-of-traditional-chinese-literature/9780231074292/ ; library TOC: https://search.cpl.org/Record/a207337	Translations from the Asian Classics	Victor H. Mair	Columbia University Press	Public publisher page exposes high-level contents; library TOC helps item-level extraction; many items are excerpts/selections	Extract public TOC and library contents; mark complete work, excerpt, selection, genre, and context item	E016;X024;X025	in_progress	Full Columbia TOC remains blocked at CPL by Cloudflare; eCampus page for ISBN 9780231074292 exposes an unrelated autobiography TOC, so it was rejected. Shorter Columbia was added separately as an abridged comparator source.
dante_digital_anchor_layer	Princeton Dante Project and Digital Dante	specialist_digital_project	Dante texts, Commedia, minor works, commentary, translation, and reference metadata	1999-ongoing	PDP: https://dante.princeton.edu/ ; MDR PDP: https://mdr-maa.org/resource/princeton-dante-project/ ; Digital Dante MDR: https://mdr-maa.org/resource/digital-dante/	online	Robert Hollander; Teodolinda Barolini and collaborators	Princeton/Columbia	Dante-specific; not broader Trecento evidence	Use for Dante work identity, minor-work coverage, commentary, and text access	E009	metadata_ready	Supports Divine Comedy and Vita Nuova; does not settle Petrarch/Boccaccio coverage
dumbarton_oaks_medieval_library	Dumbarton Oaks Medieval Library	edited_text_series	Medieval Latin, Byzantine Greek, Old English, and medieval Iberian bilingual editions	2010-ongoing	Series: https://domedieval.org/ ; 2024 catalog: https://domedieval.org/wp-content/uploads/2024/09/DOML-2024-catalog.pdf	series	Dumbarton Oaks Medieval Library language editors	Harvard University Press	Series catalog; not a canon list; copyrighted translations	Extract volume metadata, language, work identity, and edition scope	E009	metadata_ready	Strong Latin, Old English, and Iberian authority layer
e001_local_accepted_canon_records	Accepted _canon records, Wave 005 baseline	accepted_site_record	Local accepted site records in _canon/*.md	2026-05-03	Local repository snapshot at commit 64600ddb264839d57a173438490f36eeed4c31b3; _canon/*.md	Wave 005 baseline	Codex/local accepted records	benjaminkramer50.github.io	Internal accepted records only; not an external canon source; embedded evidence remains separate source debt	Parse front matter where canon_review.status starts with accepted and match canon_id to incumbent path IDs	E001	extracted	61 accepted records matched to incumbent path
e008_cambridge_greek_latin_classics	Cambridge Greek and Latin Classics	commentary_text_series	Commented Greek/Latin texts for advanced students and scholars	current Cambridge Core series	https://www.cambridge.org/core/series/cambridge-greek-and-latin-classics/9900A4E001E0221C90A6CAD4E6F45A1B	series	Series editors	Cambridge University Press	Selective pedagogical/commentary series, not comprehensive	Extract series titles, authors, publication dates, descriptions; match by work/book/selection	E008	ready_public_metadata	Useful for syllabus-level centrality and book-level selection evidence
e008_loeb_classical_library_digital	Loeb Classical Library	digital_primary_text_series	Greek and Latin literature, ca. 700 BCE-700 CE	current online database	Harvard University Press / Loeb Classical Library; Rutgers database description	digital	Loeb editors	Harvard University Press	Subscription text; public metadata uneven; Loeb presence is not automatic canon status	Use public catalog/Perseus Loeb-series metadata; do not scrape texts; classify complete works, fragments, and selections	E008	ready_with_access_limits	High-value source layer for canonical Greek/Latin coverage
e008_oxford_classical_dictionary_online	Oxford Classical Dictionary	reference_encyclopedia	Classical world reference entries, including literature, history, philosophy, religion, and reception	2015-, updated online	https://academic.oup.com/edited-volume/61673?pageSize=20&sort=titlesort&subSite=classics&t=ORE_CLA%3AREFCLA004	online living edition	Lucy Grig and contributors	Oxford University Press	Many entries gated; validates author/work importance and boundaries, not path inclusion alone	Search author/work entries and subject facets; record entry presence, subject, access status, and boundary notes	E008	ready_partial_public	Useful for boundary adjudication and author/work authority
e008_oxford_scholarly_editions_oct	Oxford Classical Texts via Oxford Scholarly Editions Online	critical_edition_series	Greek and Latin critical editions/translations including Oxford Classical Texts	current online product	OUP Classical Studies / Oxford Scholarly Editions Online	online	OUP editors	Oxford University Press	Subscription; direct title list may be incomplete publicly	Use OUP public series/product metadata plus Perseus series facet for OCT records; classify as critical-edition evidence	E008	partial_public_metadata	Strong edition-history layer, weaker for popular canon
e008_perseus_catalog_greek_latin_works	Perseus Catalog	metadata_catalog	Greek and Latin authors/works, editions, translations, series metadata	online catalog	https://catalog.perseus.org/catalog	1.0	Perseus Digital Library	Perseus Digital Library / Tufts	Work metadata, not canon ranking; includes fragmentary and non-literary material	Extract title, author, language, series, and subject facets; match to path by title, creator, aliases, and original language	E008	ready_public_metadata	Best open machine-readable crosswalk layer for Greek/Latin metadata
e008_phi_classical_latin_texts	Packard Humanities Institute Classical Latin Texts	latin_text_corpus	Latin literary texts before AD 200 plus selected later antiquity	online from PHI CD-ROM 5.3	https://latin.packhum.org/about	online	Packard Humanities Institute	Packard Humanities Institute	Latin only; mostly pre-200 CE; text license permits personal study, not bulk copying	Extract author/work metadata only: author number, work title, work number, reference edition, URL	E008	ready_public_metadata	Best open Latin corpus layer for detecting absent Latin authors/works
e012_loa_african_american_poetry_2020	African American Poetry: 250 Years of Struggle & Song	poetry_anthology	African American poetry, 1770-2020	2020	Library of America No. 333, edited by Kevin Young	LOA anthology	Kevin Young	Library of America	Poem-level evidence; not full-book evidence for every poet	Extract poet and poem rows; support poet/selection basis and poetry coverage	E012	in_progress	Pilot rows ingested; full poem-level extraction and selection policy still pending
e012_loa_slave_narratives	Slave Narratives	authoritative_collection	Slave narrative tradition, 1772-1864	LOA edition	Library of America No. 114, edited by William L. Andrews and Henry Louis Gates Jr.	LOA series edition	William L. Andrews; Henry Louis Gates Jr.	Library of America	Contains ten works; not all are equal path candidates	Extract work-level rows; match complete narratives and flag represented-by-collection	E012	in_progress	Pilot rows ingested; complete contained-work extraction still pending
e012_locke_new_negro_1925	The New Negro: An Interpretation	primary_anthology	Harlem Renaissance fiction, poetry, essays, art, music, and criticism	1925	Alain Locke, ed., A. and C. Boni, 1925	original edition	Alain Locke	A. and C. Boni	Public domain TOC/full text available; anthology source distinct from contained works	Extract one row per named contribution; distinguish anthology as source from contained works	E012	not_started	Primary Harlem Renaissance source
e012_norton_african_american_lit_4e_v1_2025	The Norton Anthology of African American Literature, Volume 1	field_anthology	Beginnings through Harlem Renaissance	2025	Henry Louis Gates Jr. et al., The Norton Anthology of African American Literature, 4th ed., W. W. Norton, 2025	4th ed.	Henry Louis Gates Jr.; Valerie Smith; William L. Andrews; Frances Smith Foster; others	W. W. Norton	Public TOC is available; copyrighted anthology text not extractable	Extract public TOC selection rows; classify complete work, excerpt, poem, song, oral item, or sermon	E012	in_progress	Pilot rows ingested; full TOC extraction and item-scope coding pending
e012_norton_african_american_lit_4e_v2_2025	The Norton Anthology of African American Literature, Volume 2	field_anthology	Realism, Naturalism, Modernism to the Present	2025	Henry Louis Gates Jr. et al., The Norton Anthology of African American Literature, 4th ed., W. W. Norton, 2025	4th ed.	Henry Louis Gates Jr.; Valerie Smith; Jesse McCarthy; Farah Jasmine Griffin; others	W. W. Norton	Public TOC is available; many entries are excerpts/selections	Extract public TOC; separate author representation from work representation	E012	in_progress	Pilot rows ingested; full TOC extraction and item-scope coding pending
e013_cambridge_history_latin_american_lit_1996	The Cambridge History of Latin American Literature	region_literary_history	Latin American literature including Brazilian literature, pre-Columbian traditions, colonial literature, and twentieth-century literature	1996; online 2008	Cambridge Core series page: https://www.cambridge.org/core/series/cambridge-history-of-latin-american-literature/F1BAF6C15BEBF9D61A58A0CE54C4338B	3 vols.	Roberto Gonzalez Echevarria; Enrique Pupo-Walker	Cambridge University Press	Reference/history layer, not anthology inclusion evidence; chapter text partly gated	Extract public chapter TOC and bibliography structure; use named works as context and authority, not direct canon votes	E013;X024	context_only	Cambridge Core chapter lists parsed into 52 chapter-context rows across Vols. 1-3.
e013_fsg_20c_latin_american_poetry_2011	The FSG Book of Twentieth-Century Latin American Poetry	poetry_anthology	Twentieth-century Latin American poetry in Spanish, Portuguese, Ladino, Spanglish, and Indigenous languages	2011/2012	Macmillan: https://academic.macmillan.com/academictrade/9780374533182/thefsgbookoftwentiethcenturylatinamericanpoetry/ ; Boulder library TOC: https://boulder.marmot.org/GroupedWork/07e23042-8c1d-b5bd-5f7c-81eebfe68805/Home	1st ed.; trade paperback	Ilan Stavans	Farrar, Straus and Giroux	Twentieth-century poetry only; overlaps Oxford poetry; edition page counts differ by format	Extract author and poem rows from library TOC; preserve bilingual titles and translator or edition notes where exposed	E013	extracted	Complete 84 creator-group public MARC 505 contents rows ingested from Boulder public record; poem groups remain selection-level evidence.
e013_oxford_latin_american_poetry_2009	The Oxford Book of Latin American Poetry: A Bilingual Anthology	poetry_anthology	Latin American poetry across more than 500 years, multilingual, original texts plus English translations	2009	Google Books: https://books.google.com/books/about/The_Oxford_Book_of_Latin_American_Poetry.html?id=UJ-Qj-Sx4RoC ; Calicut library TOC: https://find.uoc.ac.in/Record/308884/TOC	illustrated ed.	Cecilia Vicuna; Ernesto Livon-Grosman	Oxford University Press	Poetry-only; many excerpts, oral/codex items, and translation-title variants	Extract poem and selection rows from public TOC; flag excerpts, anonymous/traditional items, original language, and collection/cycle cases	E013	extracted	Public UOC TOC ingested as 137 line-item rows; rows with broken creator/title delimiters are retained raw and require later cleanup.
e013_oxford_latin_american_short_stories_1997	The Oxford Book of Latin American Short Stories	field_anthology	Latin American short fiction from colonial period to contemporary period	1997	CCA library TOC: https://library.cca.edu/cgi-bin/koha/opac-ISBDdetail.pl?biblionumber=32656 ; Google Books: https://books.google.com/books/about/The_Oxford_Book_of_Latin_American_Short.html?id=MHDRCwAAQBAJ	1st ed.	Roberto Gonzalez Echevarria	Oxford University Press	Short-story only; translated selections; not full-work evidence for authors	Extract public TOC story rows with author and translator where available; classify complete story versus excerpt	E013	extracted	Complete 53-story public TOC ingested; expanded X013/X014/X017 routing complete for eligible rows.
e014_african_writers_series_heinemann_penguin	African Writers Series	authoritative_edition_series	Modern African literary edition series: fiction, poetry, drama, essays, and biography	1962-current; 2023 title list	Pearson PDF: https://www.pearson.com/content/dam/one-dot-com/one-dot-com/international-schools/pdfs/rights-and-licensing/African-Writers-Series-2023-Oct.pdf ; Penguin Random House series: https://www.penguinrandomhouse.com/series/PAF/penguin-african-writers-series/	series	Heinemann/Pearson editors; Penguin Classics relaunch	Pearson / Penguin Random House	Edition/reception evidence, not anthology vote; English/translation and publishing-history skew; includes nonliterary prose	Parse Pearson title-list PDF and Penguin Random House title pages; classify genre, author, original language where known, and exact work identity	E014;X023	metadata_ready	Pearson 2023 rights PDF parsed into 47 title rows and PRH series page added one non-duplicate relaunch row; edition-series metadata only.
e014_cambridge_history_african_caribbean_lit_2000	The Cambridge History of African and Caribbean Literature	region_literary_history	African and Caribbean literary history, oral traditions through postcolonial literatures	2000; online 2008	Cambridge Vol. 1: https://www.cambridge.org/core/books/the-cambridge-history-of-african-and-caribbean-literature/1B9F2963235BC68CB3CA5EA6D534AC60 ; Vol. 2: https://www.cambridge.org/core/books/cambridge-history-of-african-and-caribbean-literature/383D7F023CD01BFB6AF3F29A7CDD7EB7	2 vols.	F. Abiola Irele; Simon Gikandi	Cambridge University Press	Includes Caribbean; chapter-level reference source, not direct anthology evidence; text partly gated	Extract chapter TOC and African chapter metadata; use for regional, language, and boundary checks	E014;X024	context_only	Cambridge Core chapter lists parsed into 40 chapter-context rows across Vols. 1-2.
e014_penguin_modern_african_poetry_4e_2007	The Penguin Book of Modern African Poetry	poetry_anthology	Modern African poetry; 99 poets from 27 countries	2007	Penguin Random House: https://www.penguinrandomhouse.com/books/301584/the-penguin-book-of-modern-african-poetry-by-edited-by-gerald-moore-introduction-by-gerald-moore-and-ulli-beier/	4th ed.	Gerald Moore; Ulli Beier	Penguin Classics	Official page gives strong metadata but not complete public TOC; poetry-only	Extract publisher metadata now; seek library or physical TOC before claiming exhaustive poem-level rows	E014;X023	extracted	Structured eCampus public TOC parsed into 239 poem rows under 99 poet headings; PRH official page confirms 99 poets/27 countries but not full TOC.
